{
  "artifact_bundle": {
    "path": "artifacts/golden-baseline/comprehensive-golden-baseline.zip",
    "storage": "ignored-local-or-ci-release-artifact"
  },
  "baseline": "comprehensive-golden",
  "bundle_contents": [
    "capture",
    "texts",
    "artifacts",
    "plot-similarity-metadata",
    "omissions"
  ],
  "captured_at": "2026-06-23T00:00:00Z",
  "capture_metadata": {
    "authoritative_capture_mode": "authoritative",
    "authoritative_requires_reference_environment_match": true,
    "authority_values": [
      "authoritative",
      "local-debug"
    ],
    "local_default_capture_mode": "local-debug",
    "reference_environment": {
      "id": "windows-ci-conda-python2-pyqt4-r3",
      "os": "Windows",
      "pyqt": "4.11.4",
      "python": "2.7.18",
      "r": "R version 3.3.2",
      "rpy2": "2.8.5"
    },
    "required_fields": [
      "python",
      "os",
      "r",
      "rpy2",
      "pyqt",
      "package_versions",
      "commit_sha",
      "capture_mode",
      "capture_command",
      "reference_environment",
      "authoritative",
      "authority"
    ]
  },
  "coverage_manifest": "docs/modernization/golden-coverage-manifest.json",
  "coverage_matrix": "docs/modernization/golden-coverage-matrix.md",
  "curated_golden_set": [
    "amino-binary-random",
    "continuous-random",
    "lymph-diagnostic-random-dor",
    "amino-binary-cumulative",
    "amino-binary-leave-one-out",
    "continuous-cumulative",
    "continuous-leave-one-out",
    "amino-binary-meta-regression",
    "continuous-meta-regression",
    "amino-binary-subgroup",
    "continuous-subgroup"
  ],
  "schema": "docs/modernization/golden-baseline.schema.json"
}
